{
  "schemaVersion": 1,
  "title": "Design Framework: Management-Briefing",
  "repository": "marcelrapold/design",
  "commit": "9fcf9f95dc89cf6487fe454dba031b85a3111497",
  "brand": "neutral",
  "decisionQuestion": "Welche Pilotpräsentation dient als erste gemeinsame Abnahme?",
  "sections": [
    {
      "id": "stand",
      "title": "Lieferstand"
    },
    {
      "id": "freigabe",
      "title": "Nächste Freigabe"
    }
  ],
  "slides": [
    {
      "type": "agenda",
      "title": "Design Framework: Stand und Abnahme",
      "items": [
        "Lieferstand",
        "Nächste Freigabe"
      ]
    },
    {
      "lead": {
        "period": "Quellstand 0.2 vom 11.09.2026",
        "source": "marcelrapold/design"
      },
      "sources": [
        {
          "id": "framework",
          "label": "Framework 0.2",
          "path": "README.md",
          "commit": "9fcf9f95dc89cf6487fe454dba031b85a3111497",
          "retrievedAt": "2026-09-11",
          "excerpt": "Alle 19 Atlas-UI-Module und BrandProvider"
        },
        {
          "id": "abnahme",
          "label": "Abnahme und offene Punkte",
          "path": "docs/atlas-coverage.md",
          "commit": "9fcf9f95dc89cf6487fe454dba031b85a3111497",
          "retrievedAt": "2026-09-11",
          "excerpt": "Browser-Abnahme auf Desktop und Mobilgeräten"
        },
        {
          "id": "ausgang",
          "label": "Ursprünglicher Auszug",
          "path": "docs/extraction.md",
          "commit": "a30164904c435c5677876202df1f38225e4288a7",
          "retrievedAt": "2026-09-11",
          "excerpt": "{button,card,input,badge,label}.tsx"
        }
      ],
      "type": "karten-steckbrief",
      "title": "Die Bewertung stützt sich auf drei versionierte Quellen",
      "section": "stand",
      "takeaway": "Die Aussagen beziehen sich auf den Commit 9fcf9f9. Sie bestätigen keine spätere Produktionsauslieferung.",
      "introducesSources": true
    },
    {
      "lead": {
        "period": "Quellstand 0.2 vom 11.09.2026",
        "source": "marcelrapold/design"
      },
      "sources": [
        {
          "id": "framework",
          "label": "Framework 0.2",
          "path": "README.md",
          "commit": "9fcf9f95dc89cf6487fe454dba031b85a3111497",
          "retrievedAt": "2026-09-11",
          "excerpt": "Alle 19 Atlas-UI-Module und BrandProvider"
        },
        {
          "id": "abnahme",
          "label": "Abnahme und offene Punkte",
          "path": "docs/atlas-coverage.md",
          "commit": "9fcf9f95dc89cf6487fe454dba031b85a3111497",
          "retrievedAt": "2026-09-11",
          "excerpt": "Browser-Abnahme auf Desktop und Mobilgeräten"
        },
        {
          "id": "ausgang",
          "label": "Ursprünglicher Auszug",
          "path": "docs/extraction.md",
          "commit": "a30164904c435c5677876202df1f38225e4288a7",
          "retrievedAt": "2026-09-11",
          "excerpt": "{button,card,input,badge,label}.tsx"
        }
      ],
      "type": "textbox-tabelle",
      "title": "Der Baukasten deckt mehr ab als der erste Auszug",
      "section": "stand",
      "takeaway": "Der grössere Umfang schafft eine Grundlage für gemeinsame Anwendungen. Die Nutzungsqualität braucht eine gesonderte Abnahme.",
      "metrics": [
        {
          "label": "UI-Module",
          "value": 19,
          "comparison": 5,
          "unit": "Module",
          "period": "Version 0.2",
          "comparisonPeriod": "Ursprünglicher Auszug",
          "sourceId": "framework",
          "comparisonSourceId": "ausgang"
        },
        {
          "label": "Deck-Export",
          "value": "Editierbare PPTX",
          "comparison": "Agenten-Vertrag",
          "unit": "Lieferform",
          "period": "Version 0.2",
          "comparisonPeriod": "Ursprünglicher Auszug",
          "sourceId": "abnahme",
          "comparisonSourceId": "ausgang"
        },
        {
          "label": "Inhaltsprüfung",
          "value": "JS-Validator",
          "comparison": "Dokumentierte Regeln",
          "unit": "Umsetzung",
          "period": "Version 0.2",
          "comparisonPeriod": "Ursprünglicher Auszug",
          "sourceId": "abnahme",
          "comparisonSourceId": "ausgang"
        }
      ]
    },
    {
      "lead": {
        "period": "Quellstand 0.2 vom 11.09.2026",
        "source": "marcelrapold/design"
      },
      "sources": [
        {
          "id": "framework",
          "label": "Framework 0.2",
          "path": "README.md",
          "commit": "9fcf9f95dc89cf6487fe454dba031b85a3111497",
          "retrievedAt": "2026-09-11",
          "excerpt": "Alle 19 Atlas-UI-Module und BrandProvider"
        },
        {
          "id": "abnahme",
          "label": "Abnahme und offene Punkte",
          "path": "docs/atlas-coverage.md",
          "commit": "9fcf9f95dc89cf6487fe454dba031b85a3111497",
          "retrievedAt": "2026-09-11",
          "excerpt": "Browser-Abnahme auf Desktop und Mobilgeräten"
        },
        {
          "id": "ausgang",
          "label": "Ursprünglicher Auszug",
          "path": "docs/extraction.md",
          "commit": "a30164904c435c5677876202df1f38225e4288a7",
          "retrievedAt": "2026-09-11",
          "excerpt": "{button,card,input,badge,label}.tsx"
        }
      ],
      "type": "entscheid-register",
      "title": "Der erste Einsatz braucht ein konkretes Abnahmeszenario",
      "section": "stand",
      "takeaway": "Welche Pilotpräsentation dient als erste gemeinsame Abnahme?",
      "resolution": {
        "kind": "open-question",
        "text": "Welche Pilotpräsentation dient als erste gemeinsame Abnahme?"
      },
      "claims": [
        {
          "title": "Prüfbarer Einstieg",
          "text": "Ein echtes Projektdeck kann Inhaltslogik, Bearbeitbarkeit und Brand-Anwendung gemeinsam sichtbar machen.",
          "kind": "inference",
          "sourceId": "abnahme"
        }
      ]
    },
    {
      "lead": {
        "period": "Quellstand 0.2 vom 11.09.2026",
        "source": "marcelrapold/design"
      },
      "sources": [
        {
          "id": "framework",
          "label": "Framework 0.2",
          "path": "README.md",
          "commit": "9fcf9f95dc89cf6487fe454dba031b85a3111497",
          "retrievedAt": "2026-09-11",
          "excerpt": "Alle 19 Atlas-UI-Module und BrandProvider"
        },
        {
          "id": "abnahme",
          "label": "Abnahme und offene Punkte",
          "path": "docs/atlas-coverage.md",
          "commit": "9fcf9f95dc89cf6487fe454dba031b85a3111497",
          "retrievedAt": "2026-09-11",
          "excerpt": "Browser-Abnahme auf Desktop und Mobilgeräten"
        },
        {
          "id": "ausgang",
          "label": "Ursprünglicher Auszug",
          "path": "docs/extraction.md",
          "commit": "a30164904c435c5677876202df1f38225e4288a7",
          "retrievedAt": "2026-09-11",
          "excerpt": "{button,card,input,badge,label}.tsx"
        }
      ],
      "type": "quellen-grid",
      "title": "Die Lückenliste trennt Umsetzung und Abnahme",
      "section": "freigabe",
      "takeaway": "Die folgenden offenen Punkte stammen aus dem dokumentierten Stand. Ihre Erledigung muss anhand neuer Belege bestätigt werden."
    },
    {
      "lead": {
        "period": "Quellstand 0.2 vom 11.09.2026",
        "source": "marcelrapold/design"
      },
      "sources": [
        {
          "id": "framework",
          "label": "Framework 0.2",
          "path": "README.md",
          "commit": "9fcf9f95dc89cf6487fe454dba031b85a3111497",
          "retrievedAt": "2026-09-11",
          "excerpt": "Alle 19 Atlas-UI-Module und BrandProvider"
        },
        {
          "id": "abnahme",
          "label": "Abnahme und offene Punkte",
          "path": "docs/atlas-coverage.md",
          "commit": "9fcf9f95dc89cf6487fe454dba031b85a3111497",
          "retrievedAt": "2026-09-11",
          "excerpt": "Browser-Abnahme auf Desktop und Mobilgeräten"
        },
        {
          "id": "ausgang",
          "label": "Ursprünglicher Auszug",
          "path": "docs/extraction.md",
          "commit": "a30164904c435c5677876202df1f38225e4288a7",
          "retrievedAt": "2026-09-11",
          "excerpt": "{button,card,input,badge,label}.tsx"
        }
      ],
      "type": "zwei-grosskarten",
      "title": "Eine Pilotabnahme braucht Quellstand und Anwendung",
      "section": "freigabe",
      "takeaway": "Der Pilotauftrag braucht einen festen Quellstand und konkrete Abnahmekriterien.",
      "claims": [
        {
          "title": "Dokumentation",
          "text": "Der dokumentierte Modulumfang beschreibt die Ausgangslage für einen Pilotauftrag. Er ersetzt keinen Nachweis für dessen konkretes Ergebnis.",
          "kind": "inference",
          "sourceId": "framework"
        },
        {
          "title": "Anwendung",
          "text": "Die offene Browser-Abnahme sollte an einem klar abgegrenzten Einsatz geprüft und separat dokumentiert werden.",
          "kind": "inference",
          "sourceId": "abnahme"
        }
      ]
    },
    {
      "lead": {
        "period": "Quellstand 0.2 vom 11.09.2026",
        "source": "marcelrapold/design"
      },
      "sources": [
        {
          "id": "framework",
          "label": "Framework 0.2",
          "path": "README.md",
          "commit": "9fcf9f95dc89cf6487fe454dba031b85a3111497",
          "retrievedAt": "2026-09-11",
          "excerpt": "Alle 19 Atlas-UI-Module und BrandProvider"
        },
        {
          "id": "abnahme",
          "label": "Abnahme und offene Punkte",
          "path": "docs/atlas-coverage.md",
          "commit": "9fcf9f95dc89cf6487fe454dba031b85a3111497",
          "retrievedAt": "2026-09-11",
          "excerpt": "Browser-Abnahme auf Desktop und Mobilgeräten"
        },
        {
          "id": "ausgang",
          "label": "Ursprünglicher Auszug",
          "path": "docs/extraction.md",